{"acknowledgement_required":true,"authorized_artifact_refs":[{"artifact_id":"artifact:source-led-short","artifact_kind":"source_led_video","bytes":227326,"media_type":"video/mp4","sha256":"c78d98d8103be57bda7cfc39143728dedaaefc93bcd211df8dbe22bda6460b66","uri":"artifacts/source-led-short.mp4"},{"artifact_id":"artifact:supervisual","artifact_kind":"supervisual","bytes":3219,"media_type":"image/png","sha256":"6743f44f38f09ecb75b98afe849f0ae18fec2247d5e58447b5348ad9fe6bca45","uri":"artifacts/supervisual.png"},{"artifact_id":"artifact:animation-scene","artifact_kind":"animation_scene","bytes":3764,"media_type":"image/png","sha256":"41c38159c7c0c51be7d543fe3001161f7422cf3274408d009c01016be244e115","uri":"artifacts/animation-scene.mp4"}],"decision_actor":{"actor_id":"operator:emilio","actor_type":"human","product_id":"conscious-activations-studio","workflow_role":"operator"},"decision_id":"ship-decision:d04fd2fe4aa7325a3c7ae0dd","decision_sha256":"862ac06592ab97adeb4af80f67d3108019c0fede06d89ec51fc701ffdb64901f","denial_codes":[],"request_ref":{"object_id":"ship-request:demo","sha256":"bce1fe6588da9bb2669e2e509718605830c036c749d6dc05edf698963d9a1c0a","version":"1.0.0"},"status":"AUTHORIZED"}
